id_article;nom_article;reference;code_avad;fournisseur
806;LOGICIEL D'OBSERVANCE HC 221 MAXIMIZER;900HC230;1106;FISHER PAYKEL
807;LOGICIEL POUR TOSCA 500;DOWNLOAD;1107;RADIOMETER SAS RESPIRONICS
808;LUNETTE A OXYGENE - LOC 28 MAS;LOC28MAS;583;TELEFLEX
809;LUNETTE A OXYGENE DOUBLE LUMIERE (1.2M);4805;2295;SYSTAM
810;LUNETTE A OXYGENE DOUBLE LUMIERE (2.1 M);TRP-105;1108;L3 MEDICAL
811;LUNETTE A OXYGENE EMBOUTS COURBES INTERSURGICAL;1165;586;INTERSURGICAL
812;LUNETTE A OXYGENE EMBOUTS DROITS NTERSURGICAL;1161;585;INTERSURGICAL
813;LUNETTE A OXYGENE EMBOUTS EVASES HUDSON;1104;584;TELEFLEX
814;LUNETTE A OXYGENE SALTER LABS ENFANT > 10 ANS;CS1602;587;SYSTAM
815;LUNETTE A OXYGENE SALTER LABS FAIBLE DEBIT ADULTE;CS1616;588;SYSTAM
816;LUNETTE A OXYGENE SALTER LABS NOURRISSON;CS1615;589;SYSTAM
817;LUNETTE A OXYGENE SALTER LABS PEDIATRIQUE;CS1601;1852;SYSTAM
818;LUNETTE A OXYGENE SALTER LABS STANDARD ADULTE;CS1600;590;SYSTAM
819;LUNETTE A OXYGENE UNO BLANCHE;29028490;591;AMBU
820;LUNETTE A OXYGENE UNO VERTE;29001490;1608;AMBU
821;LUNETTE NASALE POUR SOMNOCHECK;WM94043;1109;LOWENSTEIN MEDICAL
822;MALETTE DE TRANSPORT POUR VIVO 50;004938;417;BREAS
823;MANOMETRE TESTO 510;114-168;1905;RS
824;MANUEL POMPE AC INSIGHT;06651895001;2403;ROCHE DIABETE FRANCE
825;MANUEL TELECOMMANDE PERFORMA INSIGHT;07062117001;2404;ROCHE DIABETE FRANCE
826;MANUEL UTILISATION SYSTEME INSIGHT;07030428001;2405;ROCHE DIABETE FRANCE
827;MANUGEL (FLACON DE 75 ML);1048274;1192;DMD ANIOS LABORATOIRES
828;MASQUE A FUITE FITLIFE TAILLE L;1060804;197;RESPIRONICS
829;MASQUE A FUITE FITLIFE TAILLE S;1060803;198;RESPIRONICS
830;MASQUE A FUITE FITLIFE TAILLE S;1060803;2096;RESPIRONICS
831;MASQUE A FUITE FITLIFE TAILLE XL;1089994;199;RESPIRONICS
832;MASQUE A OXYGENE ADULTE;1136000;592;INTERSURGICAL
833;MASQUE A OXYGENE ADULTE HAUTE CONCENTRATION;1181;593;INTERSURGICAL
834;MASQUE A OXYGENE PEDIATRIQUE;1190;594;INTERSURGICAL
835;MASQUE A OXYGENE PEDIATRIQUE HAUTE CONCENTRATION;1192;595;INTERSURGICAL
836;MASQUE A OXYGENE SANS PINCE NEZ;1135015;2445;INTERSURGICAL
837;MASQUE AEROSOL ADULTE SMARTMASK;41G0730;468;PULMOMED
838;MASQUE AEROSOL ENFANT PARI;41G0741;469;PULMOMED
839;MASQUE AEROSOL HUDSON ADULTE;1083;470;TELEFLEX
840;MASQUE AEROSOL HUDSON PEDIATRIQUE;41085;471;TELEFLEX
841;MASQUE BUCCAL ORACLE 2 NIV ET PPC;HC452NIV;200;FISHER PAYKEL
842;MASQUE D'ANESTHESIE TAILLE L POUR CLEARWAY;1516000;2354;INTERSURGICAL
843;MASQUE D'ANESTHESIE TAILLE M POUR CLEARWAY;1515000;1609;INTERSURGICAL
844;MASQUE D'ANESTHESIE TAILLE S POUR CLEARWAY;1514000;350;INTERSURGICAL
845;MASQUE DREAMWEAR FITPACK AVEC CONDUIT M;1116700;2387;RESPIRONICS
846;MASQUE FACIAL A FUITE  QUATTRO AIR TAILLE L;62707;2261;RESMED
847;MASQUE FACIAL A FUITE  QUATTRO AIR TAILLE M;62706;1679;RESMED
848;MASQUE FACIAL A FUITE  QUATTRO AIR TAILLE S;62705;2202;RESMED
849;MASQUE FACIAL A FUITE AIRFIT F10 TAILLE L;63107;1682;RESMED
850;MASQUE FACIAL A FUITE AIRFIT F10 TAILLE M;63106;1681;RESMED
851;MASQUE FACIAL A FUITE AIRFIT F10 TAILLE S;63105;1680;RESMED
852;MASQUE FACIAL A FUITE AMARA GEL TAILLE L;1090426;2356;RESPIRONICS
853;MASQUE FACIAL A FUITE AMARA VIEW TAILLE L;1090604;2342;RESPIRONICS
854;MASQUE FACIAL A FUITE AMARA VIEW TAILLE M;1090603;2290;RESPIRONICS
855;MASQUE FACIAL A FUITE AMARA VIEW TAILLE S;1090602;2343;RESPIRONICS
856;MASQUE FACIAL A FUITE COMFORTFULL - L;1004951;201;RESPIRONICS
857;MASQUE FACIAL A FUITE COMFORTFULL - M;1004873;202;RESPIRONICS
858;MASQUE FACIAL A FUITE COMFORTFULL - S;1004881;203;RESPIRONICS
859;MASQUE FACIAL A FUITE COMFORTGEL FULL-XL;1081823;207;RESPIRONICS
860;MASQUE FACIAL A FUITE COMFORTGEL FULL -L;1081822;204;RESPIRONICS
861;MASQUE FACIAL A FUITE COMFORTGEL FULL -M;1081821;205;RESPIRONICS
862;MASQUE FACIAL A FUITE COMFORTGEL FULL -S;1081820;206;RESPIRONICS
863;MASQUE FACIAL A FUITE FLEXIFIT HC431U;HC431U;208;FISHER PAYKEL
864;MASQUE FACIAL A FUITE HC 432;HC432U;209;FISHER PAYKEL
865;MASQUE FACIAL A FUITE JOYCE - L;WM26430;210;LOWENSTEIN MEDICAL
866;MASQUE FACIAL A FUITE JOYCE - M;WM26420;211;LOWENSTEIN MEDICAL
867;MASQUE FACIAL A FUITE JOYCE - S;WM26410;212;LOWENSTEIN MEDICAL
868;MASQUE FACIAL A FUITE JOYCE - XL;WM26440;213;LOWENSTEIN MEDICAL
869;MASQUE FACIAL A FUITE JOYCE GEL - L;WM26432;214;LOWENSTEIN MEDICAL
870;MASQUE FACIAL A FUITE JOYCE GEL - M;WM26422;215;LOWENSTEIN MEDICAL
871;MASQUE FACIAL A FUITE JOYCE GEL - S;WM26412;216;LOWENSTEIN MEDICAL
872;MASQUE FACIAL A FUITE JOYCE PLUS - L;WM26433;217;LOWENSTEIN MEDICAL
873;MASQUE FACIAL A FUITE JOYCE PLUS - XL;WM26443;218;LOWENSTEIN MEDICAL
874;MASQUE FACIAL A FUITE MIRAGE LIBERTY - L;61307;219;RESMED
875;MASQUE FACIAL A FUITE MIRAGE LIBERTY - S;61306;220;RESMED
876;MASQUE FACIAL A FUITE MIRAGE QUATTRO - L;61223;221;RESMED
877;MASQUE FACIAL A FUITE MIRAGE QUATTRO - M;61222;222;RESMED
878;MASQUE FACIAL A FUITE MIRAGE QUATTRO - S;61221;223;RESMED
879;MASQUE FACIAL A FUITE MIRAGE QUATTRO - XS;61220;224;RESMED
880;MASQUE FACIAL A FUITE QUATTRO FX - L;61705;225;RESMED
881;MASQUE FACIAL A FUITE QUATTRO FX - M;61704;226;RESMED
882;MASQUE FACIAL A FUITE QUATTRO FX - S;61703;227;RESMED
883;MASQUE FACIAL A FUITE SIMPLUS 2 BULLES L;KIT400481;1612;FISHER PAYKEL
884;MASQUE FACIAL A FUITE SIMPLUS 2 BULLES M;KIT400480;1611;FISHER PAYKEL
885;MASQUE FACIAL A FUITE SIMPLUS 2 BULLES S;KIT400479;1610;FISHER PAYKEL
886;MASQUE FACIAL A FUITE SIMPLUS BULLE M / BULLE L;400478;1613;FISHER PAYKEL
887;MASQUE FACIAL A FUITE SIMPLUS TAILLE L;SIMPLUS L;1775;FISHER PAYKEL
888;MASQUE FACIAL A FUITE SIMPLUS TAILLE M;SIMPLUS M;1774;FISHER PAYKEL
889;MASQUE FACIAL A FUITE SIMPLUS TAILLE S;SIMPLUS S;1773;FISHER PAYKEL
890;MASQUE FACIAL A FUITE SLEEPWEAVER TAILLE L;100965;2358;L3 MEDICAL
891;MASQUE FACIAL A FUITE SLEEPWEAVER TAILLE M;100960;1890;L3 MEDICAL
892;MASQUE FACIAL A FUITE SLEEPWEAVER TAILLE S;100955;1918;L3 MEDICAL
893;MASQUE FACIAL A FUITE ULTRA MIRAGE - L;60694;228;RESMED
894;MASQUE FACIAL A FUITE ULTRA MIRAGE - LSH;60695;229;RESMED
895;MASQUE FACIAL A FUITE ULTRA MIRAGE - M;60692;230;RESMED
896;MASQUE FACIAL A FUITE ULTRA MIRAGE - MSH;60693;231;RESMED
897;MASQUE FACIAL A FUITE ULTRA MIRAGE - S;60690;232;RESMED
898;MASQUE FACIAL A FUITE ULTRA MIRAGE - SSH;60691;233;RESMED
899;MASQUE FACIAL A FUITE VERASEAL TAILLE L;005564;234;BREAS
900;MASQUE FACIAL A FUITE VERASEAL TAILLE M;005563;235;BREAS
901;MASQUE FACIAL A FUITE VERASEAL TAILLE S;005562;236;BREAS
902;MASQUE FACIAL FLEXIFIT HC 431;HC431NIV;237;FISHER PAYKEL
903;MASQUE FACIAL FORMA - TAILLE L;400472NIV;238;FISHER PAYKEL
904;MASQUE FACIAL FORMA - TAILLE M;400474NIV;239;FISHER PAYKEL
905;MASQUE FACIAL FORMA - TAILLE S;400470NIV;240;FISHER PAYKEL
906;MASQUE FACIAL FORMA - TAILLE XL;400473U;241;FISHER PAYKEL
907;MASQUE FACIAL INTEGRAL TOTALFACE;302433;242;RESPIRONICS
908;MASQUE FACIAL MOJO;50836;1662;L3 MEDICAL
909;MASQUE FACIAL SANS FUITE  QUATTRO AIR TAILLE L;62785;2352;RESMED
910;MASQUE FACIAL SANS FUITE  QUATTRO AIR TAILLE S;62783;2353;RESMED
911;MASQUE FACIAL SANS FUITE COMFORTFULLSE L;1024262;243;RESPIRONICS
912;MASQUE FACIAL SANS FUITE COMFORTFULLSE M;1024261;244;RESPIRONICS
913;MASQUE FACIAL SANS FUITE COMFORTFULLSE S;1023747;245;RESPIRONICS
914;MASQUE FACIAL SANS FUITE JOYCE TAILLE L;WM26481;1848;LOWENSTEIN MEDICAL
915;MASQUE FACIAL SANS FUITE JOYCE TAILLE M;WM26471;1849;LOWENSTEIN MEDICAL
916;MASQUE FACIAL SANS FUITE QUATTRO FX - L;61744;246;RESMED
917;MASQUE FACIAL SANS FUITE QUATTRO FX - M;61743;247;RESMED
918;MASQUE FACIAL SANS FUITE QUATTRO FX - S;61742;248;RESMED
919;MASQUE FACIAL SANS FUITE ULTRA MIRAGE L;60647;249;RESMED
920;MASQUE FACIAL SANS FUITE ULTRA MIRAGE LS;60646;250;RESMED
921;MASQUE FACIAL SANS FUITE ULTRA MIRAGE M;60645;251;RESMED
922;MASQUE FACIAL SANS FUITE ULTRA MIRAGE MS;60644;252;RESMED
923;MASQUE FACIAL SANS FUITE ULTRA MIRAGE S;60643;253;RESMED
924;MASQUE FACIAL SANS FUITE ULTRA MIRAGE SS;60642;254;RESMED
925;MASQUE FACIAL VYGON TAILLE 5;5557.55;255;VYGON
926;MASQUE FACIAL VYGON TAILLE 6;5557.65;256;VYGON
927;MASQUE LAERDAL ADULTE N° 4 / 5 +;870220;257;LAERDAL MEDICAL
928;MASQUE LAERDAL ENFANT N° 3 / 4;860220;258;LAERDAL MEDICAL
929;MASQUE LAERDAL NOUVEAU-NE N° 0 / 0;851500;259;LAERDAL MEDICAL
930;MASQUE LAERDAL NOUVEAU-NE N° 0 / 1;851600;261;LAERDAL MEDICAL
931;MASQUE LAERDAL NOUVEAU-NE N° 2;851700;262;LAERDAL MEDICAL
932;MASQUE NARINAIRE OPUS;HC482;263;FISHER PAYKEL
933;MASQUE NASAL A FUITE ACCLAIM2;HC401;264;FISHER PAYKEL
934;MASQUE NASAL A FUITE AIRFIT N10 TAILLE SMALL;63227;1893;RESMED
935;MASQUE NASAL A FUITE AIRFIT N10 TAILLE STANDARD;63209;1628;RESMED
936;MASQUE NASAL A FUITE AIRFIT N10 TAILLE WIDE;63211;2258;RESMED
937;MASQUE NASAL A FUITE AIRFIT P10;62901;2383;RESMED
938;MASQUE NASAL A FUITE AIRFIT P10 FOR HER;62911;1683;RESMED
939;MASQUE NASAL A FUITE COMFORTCLASSIC - M;1007968;265;RESPIRONICS
940;MASQUE NASAL A FUITE COMFORTCLASSIC - S;1007967;266;RESPIRONICS
941;MASQUE NASAL A FUITE COMFORTFUSION - M;1042214;267;RESPIRONICS
942;MASQUE NASAL A FUITE COMFORTFUSION - S;1042213;268;RESPIRONICS
943;MASQUE NASAL A FUITE COMFORTFUSION FITPACK M/S;1040838;269;RESPIRONICS
944;MASQUE NASAL A FUITE COMFORTGEL BLUE - L;1070064;270;RESPIRONICS
945;MASQUE NASAL A FUITE COMFORTGEL BLUE - M;1070065;271;RESPIRONICS
946;MASQUE NASAL A FUITE COMFORTGEL BLUE - P;1070067;272;RESPIRONICS
947;MASQUE NASAL A FUITE COMFORTGEL BLUE - S;1070066;273;RESPIRONICS
948;MASQUE NASAL A FUITE COMFORTLITE II-1025171;1025171;274;RESPIRONICS
949;MASQUE NASAL A FUITE EASYLIFE - L;1050029;277;RESPIRONICS
950;MASQUE NASAL A FUITE EASYLIFE - M;1050027;278;RESPIRONICS
951;MASQUE NASAL A FUITE EASYLIFE - MW;1050028;279;RESPIRONICS
952;MASQUE NASAL A FUITE EASYLIFE - S;1050026;280;RESPIRONICS
953;MASQUE NASAL A FUITE EASYLIFE  - MW / L;1050089;275;RESPIRONICS
954;MASQUE NASAL A FUITE EASYLIFE  - S / M;1050088;276;RESPIRONICS
955;MASQUE NASAL A FUITE EASYLIFE 2  P;1050025;281;RESPIRONICS
956;MASQUE NASAL A FUITE ESON 2  BULLES L;KIT400455;282;FISHER PAYKEL
957;MASQUE NASAL A FUITE ESON 2 BULLES M;KIT400454;284;FISHER PAYKEL
958;MASQUE NASAL A FUITE ESON 2 BULLES S;KIT400453;285;FISHER PAYKEL
959;MASQUE NASAL A FUITE ESON BULLE M / BULLE L;400452;283;FISHER PAYKEL
960;MASQUE NASAL A FUITE ESON TAILLE L;ESON L;1770;FISHER PAYKEL
961;MASQUE NASAL A FUITE ESON TAILLE M;ESON M;1771;FISHER PAYKEL
962;MASQUE NASAL A FUITE ESON TAILLE S;ESON S;1772;FISHER PAYKEL
963;MASQUE NASAL A FUITE FLEXIFIT HC 405;HC405;286;FISHER PAYKEL
964;MASQUE NASAL A FUITE IQ ET HARNAIS;50250;287;L3 MEDICAL
965;MASQUE NASAL A FUITE IQ GEL;50655;1664;L3 MEDICAL
966;MASQUE NASAL A FUITE JOYCE - L;WM26130;288;LOWENSTEIN MEDICAL
967;MASQUE NASAL A FUITE JOYCE - M;WM26120;289;LOWENSTEIN MEDICAL
968;MASQUE NASAL A FUITE JOYCE - S;WM26110;290;LOWENSTEIN MEDICAL
969;MASQUE NASAL A FUITE JOYCE - XL;WM26140;291;LOWENSTEIN MEDICAL
970;MASQUE NASAL A FUITE JOYCE EASY - M;WM25520;1614;LOWENSTEIN MEDICAL
971;MASQUE NASAL A FUITE JOYCE EASY - S;WM25510;1615;LOWENSTEIN MEDICAL
972;MASQUE NASAL A FUITE JOYCE GEL - L;WM26132;292;LOWENSTEIN MEDICAL
973;MASQUE NASAL A FUITE JOYCE GEL - M;WM26122;293;LOWENSTEIN MEDICAL
974;MASQUE NASAL A FUITE JOYCE GEL - S;WM26112;294;LOWENSTEIN MEDICAL
975;MASQUE NASAL A FUITE JOYCE ONE;WM25290;2060;LOWENSTEIN MEDICAL
976;MASQUE NASAL A FUITE LE PETIT HC 406;HC406;295;FISHER PAYKEL
977;MASQUE NASAL A FUITE MIRAGE ACTIVA LT-  LW;60153;298;RESMED
978;MASQUE NASAL A FUITE MIRAGE ACTIVA LT - L;60152;296;RESMED
979;MASQUE NASAL A FUITE MIRAGE ACTIVA LT - M;60151;297;RESMED
980;MASQUE NASAL A FUITE MIRAGE FX STANDARD;62100;299;RESMED
981;MASQUE NASAL A FUITE MIRAGE MICRO - L;16997;301;RESMED
982;MASQUE NASAL A FUITE MIRAGE MICRO - LW;16998;302;RESMED
983;MASQUE NASAL A FUITE MIRAGE MICRO - M;16996;303;RESMED
984;MASQUE NASAL A FUITE MIRAGE MICRO - S;16353;304;RESMED
985;MASQUE NASAL A FUITE MIRAGE SWIFT BELLA;61561;305;RESMED
986;MASQUE NASAL A FUITE MIRAGE SWIFT BELLA GRAY;61569;1889;RESMED
987;MASQUE NASAL A FUITE MIRAGE SWIFT FX;61501;306;RESMED
988;MASQUE NASAL A FUITE MIRAGE SWIFT FX NANO;62202;2359;RESMED
989;MASQUE NASAL A FUITE MIRAGE SWIFT II;60518;307;RESMED
990;MASQUE NASAL A FUITE MIRAGE SWIFT LT;60561;308;RESMED
991;MASQUE NASAL A FUITE MIRAGE SWIFT LT - F;60589;309;RESMED
992;MASQUE NASAL A FUITE MIRAGE VISTA - DEEP;60028;310;RESMED
993;MASQUE NASAL A FUITE MIRAGE VISTA - S;60027;311;RESMED
994;MASQUE NASAL A FUITE PEDIATRIQUE PIXI;61031;312;RESMED
995;MASQUE NASAL A FUITE PILAIRO;400421U;313;FISHER PAYKEL
996;MASQUE NASAL A FUITE PROFILE LITE - L;1004118;2302;RESPIRONICS
997;MASQUE NASAL A FUITE PROFILE LITE - M;1004116;316;RESPIRONICS
998;MASQUE NASAL A FUITE PROFILE LITE - MS;1004115;317;RESPIRONICS
999;MASQUE NASAL A FUITE PROFILE LITE - P;1004113;2304;RESPIRONICS
1000;MASQUE NASAL A FUITE PROFILE LITE - S;1004114;320;RESPIRONICS
1001;MASQUE NASAL A FUITE PROFILE LITE PEDIATRIQUE - SC;1008829;321;RESPIRONICS
1002;MASQUE NASAL A FUITE SLEEPWEAVER ADVANCE BLEU;100274;2442;L3 MEDICAL
1003;MASQUE NASAL A FUITE TRUEBLUE TAILLE P;1071838;1616;RESPIRONICS
1004;MASQUE NASAL A FUITE TRUEBLUE TAILLE S;1071839;1678;RESPIRONICS
1005;MASQUE NASAL A FUITE ULTRA MIRAGE - L;16329;322;RESMED
1006;MASQUE NASAL A FUITE ULTRA MIRAGE - LSH;16331;323;RESMED
1007;MASQUE NASAL A FUITE ULTRA MIRAGE - S;16328;324;RESMED
1008;MASQUE NASAL A FUITE ULTRA MIRAGE - SSH;16330;325;RESMED
1009;MASQUE NASAL A FUITE ZEST Q PETIT;400444U;326;FISHER PAYKEL
1010;MASQUE NASAL A FUITE ZEST Q PLUS;400446U;327;FISHER PAYKEL
1011;MASQUE NASAL A FUITE ZEST Q STANDARD;400445U;328;FISHER PAYKEL
1012;MASQUE NASAL BREEZE;Y-101400-MD-C;1663;SEFAM
1013;MASQUE NASAL FLEXIFIT HC 407;HC407NIV;329;FISHER PAYKEL
1014;MASQUE NASAL NUANCE PRO GEL;1105168;2262;RESPIRONICS
1015;MASQUE NASAL SANS FUITE COMFORTGEL BLUE L;1070068;346;RESPIRONICS
1016;MASQUE NASAL SANS FUITE COMFORTGEL BLUE M;1070069;347;RESPIRONICS
1017;MASQUE NASAL SANS FUITE COMFORTGEL BLUE P;1070071;348;RESPIRONICS
1018;MASQUE NASAL SANS FUITE COMFORTGEL BLUE S;1070070;349;RESPIRONICS
1019;MASQUE NASAL SANS FUITE EASYLIFE - L;1050034;330;RESPIRONICS
1020;MASQUE NASAL SANS FUITE EASYLIFE - M;1050032;331;RESPIRONICS
1021;MASQUE NASAL SANS FUITE EASYLIFE - MW;1050033;332;RESPIRONICS
1022;MASQUE NASAL SANS FUITE EASYLIFE - P;1050030;333;RESPIRONICS
1023;MASQUE NASAL SANS FUITE EASYLIFE - S;1050031;334;RESPIRONICS
1024;MASQUE NASAL SANS FUITE IQ ET HARNAIS;50660;335;L3 MEDICAL
1025;MASQUE NASAL SANS FUITE PROFILE LITE  L;1006319;336;RESPIRONICS
1026;MASQUE NASAL SANS FUITE PROFILE LITE  LN;1006320;337;RESPIRONICS
1027;MASQUE NASAL SANS FUITE PROFILE LITE  M;1006317;338;RESPIRONICS
1028;MASQUE NASAL SANS FUITE PROFILE LITE  MS;1006316;339;RESPIRONICS
1029;MASQUE NASAL SANS FUITE PROFILE LITE  MW;1006318;340;RESPIRONICS
1030;MASQUE NASAL SANS FUITE PROFILE LITE  P;1006314;341;RESPIRONICS
1031;MASQUE NASAL SANS FUITE PROFILE LITE  S;1006315;342;RESPIRONICS
1032;MASQUE NASAL SANS FUITE ULTRA MIRAGE - L;60410;343;RESMED
1033;MASQUE NASAL SANS FUITE ULTRA MIRAGE - S;60409;344;RESMED
1034;MASQUE NASAL SANS FUITE ULTRA MIRAGE -SH;60411;345;RESMED
1035;MASQUE NASAL SLEEPWEAVER ELAN BLEU;100782;1873;L3 MEDICAL
1036;MASQUE OPTILIFE - 103 68 33;1036833;352;RESPIRONICS
1037;MASQUE OPTILIFE - 103 68 34;1036834;353;RESPIRONICS
1038;MASQUE PEDIATRIQUE RESPIREO SOFT BABY S;KM225400;2414;AIR LIQUIDE
1039;MASQUE PEDIATRIQUE RESPIREO SOFT BABY XS;KM225300;2307;AIR LIQUIDE
1040;MASQUE PERFORMATRAK TAILLE L;1012635;2253;RESPIRONICS
1041;MASQUE PERFORMATRAK TAILLE M;1012574;2252;RESPIRONICS
1042;MASQUE PERFORMATRAK TAILLE S;1012573;1598;RESPIRONICS
1043;MASQUE POUR INSUFFLATEUR TAILLE 0 BEBE;000315000;1779;AMBU
1044;MASQUE POUR INSUFFLATEUR TAILLE 0A NOUVEAU NE;000313000;1780;AMBU
1045;MASQUE POUR INSUFFLATEUR TAILLE 2;000316000;1916;AMBU
1046;MASQUE POUR INSUFFLATEUR TAILLE 5;000317000;1917;AMBU
1047;MASQUE POUR TRACHEOTOMIE ADULTE;1075;1304;TELEFLEX
1048;MASQUE WISP TAILLE S/M;116928;1797;RESPIRONICS
1049;MENTONNIERE DELUXE RESPIRONICS;1006085;354;RESPIRONICS
1050;MENTONNIERE RESMED;16015;355;RESMED
1051;MENTONNIERE RESPIRONICS;302175;356;RESPIRONICS
1052;MENTONNIERE RUBY TAILLE L;AG302000L;2415;L3 MEDICAL
1053;MENTONNIERE RUBY TAILLE M;AG302000M;1892;L3 MEDICAL
1054;MINI LINK AVEC SERTER ENLITE;MMT-7725WW;960;MEDTRONIC
1055;"MINI SPIKE MICRO-TIP
";4550510;1864;BRAUN
1056;MODULE CONNECTEUR PC / PR1;1061644A;357;RESPIRONICS
1057;NETTOYANT INDUSTRIEL WURTH;0893140;1704;WURTH
1058;NEZ ARTIFICIEL HUMID-VENT GIBECK - 11112;11112;1173;TELEFLEX
1059;NEZ ARTIFICIEL HUMID-VENT MINI;10011;1174;TELEFLEX
1060;NEZ ARTIFICIEL HYDRO-TRACH 2;1873;1175;INTERSURGICAL
1061;NEZ ARTIFICIEL HYGROFLUX TRACHEO + RACCORD OXYGENE;501.20;1176;VYGON
1062;NEZ ARTIFICIEL HYGROLIFE II;353S19007;1177;COVIDIEN MEDTRONIC
1063;NEZ TRACHVENT + PROPRE AVEC APPORT O2;41312;1673;TELEFLEX
1064;NOCOBOX;5000.020;2424;L3 MEDICAL
1065;NOCOLYSE NEUTRE 1L;4040.001;2369;L3 MEDICAL
1066;NUTRA CAKE PRUNEAUX;101617401;2425;LACTALIS NUTRITION SANTE
1067;NUTRINI STANDARD 500ML;40782;2190;NUTRICIA
1068;NUTRINIMAX ENERGY 500 ML;40820;2282;NUTRICIA
1069;NUTRISON ADVANCED DIASON PACK 1 LITRE;91452;698;NUTRICIA
1070;NUTRISON ENERGY MULTI FIBRES PACK 1 LITRE;42675;700;NUTRICIA
1071;NUTRISON ENERGY MULTI FIBRES PACK 500 ML;42674;701;NUTRICIA
1072;NUTRISON ENERGY PACK 1 LITRE;40962;702;NUTRICIA
1073;NUTRISON ENERGY PACK 500 ML;41660;703;NUTRICIA
1074;NUTRISON MULTI FIBRES PACK 1 LITRE;40964;704;NUTRICIA
1075;NUTRISON MULTI FIBRES PACK 500 ML;40933;705;NUTRICIA
1076;NUTRISON PROTEIN PLUS ENERGY 1.5 PACK 1 LITRE;56342;706;NUTRICIA
1077;NUTRISON PROTEIN PLUS ENERGY 1.5 PACK 500 ML;56343;707;NUTRICIA
1078;NUTRISON PROTEIN PLUS ENERGY MULTI FIBRES 1 LITRE;104931;708;NUTRICIA
1079;NUTRISON PROTEIN PLUS ENERGY MULTI FIBRES 500 ML;104930;709;NUTRICIA
1080;NUTRISON STANDARD  PACK 500 ML;40975;710;NUTRICIA
1081;NUTRISON STANDARD PACK 1 LITRE;40986;711;NUTRICIA
1082;OBTURATEUR STOPPEUR BLANC;4097076;843;BRAUN
1083;OUTIL PEEP VALVE ALPHA 300;KC041600;2386;AIR LIQUIDE
1084;Pack batterie universelle Respironics;1028888;2441;RESPIRONICS
1085;PACK POMPE - TROUSSE DE VOYAGE ANIMAS;100-034-00;961;ANIMAS
1086;PAIRE SOUFFLETS ADAM TAILLE L;S-616325 00A;1836;SEFAM
1087;PAIRE SOUFFLETS ADAM TAILLE M;S-616324-00C;1618;SEFAM
1088;PAIRE SOUFFLETS ADAM TAILLE S;S-616323-00C;1619;SEFAM
1089;PANSEMENT TRACHEOSTOMIE 3.2X3.2;409426;2084;HARTMANN
1090;PASSE SONDE NASO GASTRIQUE;452040;712;RESPIRONICS
1091;PATCH NASAL GECKO TAILLE L;61917;364;RESMED
1092;PATCH NASAL GECKO TAILLE S;61916;365;RESMED
1093;PATE ABRASIVE EVERI. TUBE DE 160 G;WM96549;1113;LOWENSTEIN MEDICAL
1094;PATE ADHESIVE GRASS EC2 TUBE DE 100 G;441;1114;PACTRONIC
1095;PEAK FLOW MINI WRIGHT;MWS;2097;MEDIFLUX
1096;PELUCHE LENNY;LENNY;962;MEDTRONIC
1097;PESON 0.5L AVEC BRETELLE ET CACHE;LF118600;2196;CRYOPAL
1098;PESON 1.2LF;LF118500;2195;CRYOPAL
1099;PIED A PERFUSION;224250;1778;PARAMAT
1100;PIED MOBILE POUR TRILOGY;1047410;366;RESPIRONICS
1101;PIED POUR EOLE 3;PIE005529;367;RESMED
1102;PIED POUR TRILOGY 100;1029360;368;RESPIRONICS
1103;PIEGE A EAU FISHER & PAYKEL;900MR139;1179;FISHER PAYKEL
1104;PILE 9 V;PILE-9V;602;CHRONOPILES
1105;PILE A L'OXYDE D'ARGENT 1.55 V TYPE 355A;603728;981;MEDTRONIC
1106;PILE ALCALINE TYPE AA;100002;982;CHRONOPILES
1107;PILE ALCALINE TYPE AAA;100001;983;CHRONOPILES
1108;PILE ALCALINE TYPE LR1 - 1.5 V;PILE-LR1;1115;CHRONOPILES
1109;PILE LITHIUM 3 V - CR 123A;PILE-CR123A;847;CHRONOPILES
1110;PILE LITHIUM 3 V - CR 2032;PILE-CR2032;1116;RS
1111;PILE LITHIUM POUR POMPE D-TRONPLUS;04956532001;984;ROCHE DIABETE FRANCE
1112;PILE LITHIUM TYPE 1/2AA - 3.6 V;PILE-1/2AA-LI;1117;CHRONOPILES
1113;PILE LITHIUM TYPE AA;140040;985;CHRONOPILES
1114;PILE RECHARGEABLE AAA PAR 2;120206;2444;CHRONOPILES
1115;PILES RECHARGEABLES EFLOW;978B7002;475;PULMOMED
1116;PINCE A DENUDER;724-3869;1805;RS
1117;PINCE COUPANTE;205-4829;1804;RS
1118;PINCE DE FIXATION POUR CAPTEUR TOSCA;5601300;1118;RADIOMETER SAS RESPIRONICS
1119;PINCE NEZ JAUNE;AC29Y;369;TELEFLEX
1120;PINCE POUR OXYMETRE N560;DS100A;1119;COVIDIEN MEDTRONIC
1121;PLATEAU DE FIXATION FISHER & PAYKEL;900HC007;1180;FISHER PAYKEL
1122;PLATINUM S;PLATINUM 5;2296;INVACARE POIRIER
1123;POCHE A EAU 500ML;NP1GB;1620;MEDWIN FRANCE
1124;POCHE A EAU VIDE HYDROBAG - 1.5 L;7751101;715;FRESENIUS KABI
1125;POCHE A URINE UREOPLAST VV;457002;2075;THERMOFINA
1126;POCHETTE BLANCHE POUR SOUTIEN GORGE;06364543001;987;ROCHE DIABETE FRANCE
1127;POCHETTE CEINTURE SPORT;ACC 250;2431;MEDTRONIC
1128;POCHETTE CUISSE ANIMAS BLANCHE;100-032-01;988;ANIMAS
1129;POCHETTE CUISSE ANIMAS NOIRE;100-032-00;989;ANIMAS
1130;POCHETTE JAMBE BEIGE;ACC-205BE;990;MEDTRONIC
1131;POCHETTE JAMBE NOIRE;ACC-205BK;991;MEDTRONIC
1132;POCHETTE JEAN GARCON - ACC-150 BY;ACC-150BY;992;MEDTRONIC
1133;POCHETTE JEAN RENFORCEE FILLE MEDTRONIC;ACC-150GL;993;MEDTRONIC
1134;POCHETTE MATELASSEE BULLES 110*160 PAR 100;566079;2108;CENPAC
1135;POCHETTE MATELASSEE BULLES 220*260 PAR 100;566083;2109;CENPAC
1136;POCHETTE NOIRE POUR SOUTIEN GORGE;06364535001;994;ROCHE DIABETE FRANCE
1137;POCHETTE POUR ACCUFUSER;PL10034;848;WYM
1138;POCHETTE SOUTIEN GORGE BLANC POUR IR 2020;100-023-00;995;ANIMAS
1139;POCHETTE SOUTIEN GORGE NOIR POUR IR 2020;100-023-00;2336;ANIMAS
1140;POCHETTE TAILLE BEIGE - MEDTRONIC;ACC-255BE;996;MEDTRONIC
1141;POCHETTE TAILLE NOIRE - MEDTRONIC;ACC-255BK;997;MEDTRONIC
1142;POIRE A BOLUS POUR POMPE CADD LEGACY;21-6620-24;849;SMITHS MEDICAL
1143;POIRE A BOLUS POUR RYTHMIC PLUS CONNECT;KS5.01.410.5;850;SMD
1144;POMPE PATCH OMNIPOD2;14810;2399;YPSOMED SAS
1145;PORTE SOUFFLET ADAM;S-213700-00B;1621;SEFAM
1146;POUDRE DE PROTEIN DELICAL;102668801;2428;LACTALIS NUTRITION SANTE
1147;PRISE D AIR N° 1;4190050;1622;BRAUN
1148;PROLONGATEUR ABS COUDE 61 CM;6-2422;1571;ABS BOLTON
1149;PROLONGATEUR AVEC AUTOFLUSH OCTOPUS 1;5223.01;718;VYGON
1150;PROLONGATEUR AVEC BIONECTEUR 2 ET CLAMP OCTOPUS 1;5222.014;719;VYGON
1151;PROLONGATEUR AVEC ROBINET 3 VOIES;141.00;1627;VYGON
1152;PROLONGATEUR AVEC ROBINET 3 VOIES ET FILTRE PURGE;PR3LVMSP30F;2080;DIDACTIC
1153;PROLONGATEUR MINI ONE;8-1255;1625;ABS BOLTON
1154;PROLONGATEUR POLYVALENT 13.5CM;220.010;1891;VYGON
1155;PROLONGATEUR POLYVALENT 200 CM;220200;1623;VYGON
1156;PROLONGATEUR POUR SERINGUE ELECTRIQUE;1155.10;723;VYGON
1157;PROLONGATEUR SECUR LOCK COUDE ENFIT - 61CM;201880;1695;ASEPT INMED
1158;PROLONGATEUR SECUR LOCK COUDE SITES EN Y - 30.5 CM;200379;721;ASEPT INMED
1159;PROTECTION POUR POWER PACK;10000609;379;COVIDIEN MEDTRONIC
1160;PROTEGE OREILLES POUR LUNETTES A OXYGENE;TRP-OXY;606;L3 MEDICAL
1161;PROVOX ADAPTATEUR POUR LARYTUBE - 72 63;TS7263;1317;ATOS MEDICAL
1162;PROVOX ADHESIF FLEXIDERM OVALE - 72 54;TS7254;1318;ATOS MEDICAL
1163;PROVOX ADHESIF FLEXIDERM ROND - 72 53;TS7253;1319;ATOS MEDICAL
1164;PROVOX ADHESIF OPTIDERM OVALE - 72 56;TS7256;1320;ATOS MEDICAL
1165;PROVOX ADHESIF OPTIDERM ROND- 72 55;TS7255;1321;ATOS MEDICAL
1166;PROVOX ADHESIF XTRABASE ROND PROFOND;TS7265;1877;ATOS MEDICAL
1167;PROVOX BASE ADHESIVE - 72 69;TS7269;1322;ATOS MEDICAL
1168;PROVOX BRUSH POUR IMPLANT - 72 04;TS7204;1323;ATOS MEDICAL
1169;PROVOX HME CASSETTE COMPACT HIFLOW -7237;TS7237;1324;ATOS MEDICAL
1170;PROVOX HME CASSETTE COMPACT NORMAL -7236;TS7236;1325;ATOS MEDICAL
1171;PROVOX HME CASSETTE FREEHANDS - 77 12;TS7712;1326;ATOS MEDICAL
1172;PROVOX HME CASSETTE HIFLOW - 72 41 fin de commerci;TS7241;1327;ATOS MEDICAL
1173;PROVOX HME CASSETTE NORMAL - 72 40;TS7240;1328;ATOS MEDICAL
1174;PROVOX HME CASSETTE XTRAFLOW - 7241X;TS7241X;1329;ATOS MEDICAL
1175;PROVOX HME XTRAMOIST - 72 40X;TS7240X;2395;ATOS MEDICAL
1176;PROVOX LARYTUBE 10/55 - ID 12;TS7611;1330;ATOS MEDICAL
1177;PROVOX LARYTUBE 8/55 - ID 9.5;TS7603;1331;ATOS MEDICAL
1178;PROVOX LARYTUBE 9/55 - ID 10.5 MM;TS7607F;1332;ATOS MEDICAL
1179;PROVOX LARYTUBE FENETRE 10/55 - TS 7644;TS7644FR;2394;ATOS MEDICAL
1180;PROVOX LARYTUBE FENETRE 8/55 - TS 7638;TS7638FR;2393;ATOS MEDICAL
1181;PROVOX LARYTUBE FENETRE 9/55 - TS 76 41;TS7641FR;1333;ATOS MEDICAL
1182;PROVOX LARYTUBE FENETREE 9/36;TS7640F;1334;ATOS MEDICAL
1183;PROVOX PROTECTION DOUCHE;TS7260;1335;ATOS MEDICAL
1184;PROVOX PROTHESE PHONATOIRE 2-4.5MM;TS726;1336;ATOS MEDICAL
1185;PROVOX TUBEBRUSH 12 MM - 76 61;7661;2216;ATOS MEDICAL
1186;PROVOX TUBEBRUSH 9 MM - 76 60;TS7660;1337;ATOS MEDICAL
1187;PROVOX XTRAFLOW HME;7291;1338;ATOS MEDICAL
1188;QUICK SERTER DISPOSITIF D'INSERTION POUR QUICK-SET;MMT-395;1006;MEDTRONIC
1189;"RACCORD ""Y"" POUR SERINGUE CRONO 
";"PY32PF
";1866;PENTAFERTE
1190;RACCORD A FUITE RESPIRONICS (WHISPER SWIVEL);332113;381;RESPIRONICS
1191;RACCORD A FUITE WEINMANN;WM23600;382;LOWENSTEIN MEDICAL
1192;RACCORD A OXYGNE POUR VIVO 50;005032;383;BREAS
1193;RACCORD BICONIQUE DROIT - 881.00;881.00;607;VYGON
1194;RACCORD BICONIQUE DROIT 3.0-5.0 / 3.0-5;881.33;608;VYGON
1195;RACCORD BICONIQUE DROIT 3.0-5.0 / 7.0-10;881.37;609;VYGON
1196;RACCORD BICONIQUE DROIT 4.0-6.0 / 4.0-6.;881.44;610;VYGON
1197;RACCORD BICONIQUE DROIT 4.0-7.0 / 7.0-10;881.47;611;VYGON
1198;RACCORD BICONIQUE DROIT 6.0-8.0 / 6.0-8.;881.66;612;VYGON
1199;RACCORD BICONIQUE DROIT 7.0-10.0 / 7.0-1;881.77;613;VYGON
1200;RACCORD COUDE FISHER & PAYKEL 22F/22M;900MR130;384;FISHER PAYKEL
1201;RACCORD COUDE POUR AEROGEN;NKD-AG-AS1075;2407;NIHON KOHDEN
1202;RACCORD COUDE POUR BALLON INTEGRATEUR E3;COU004508;385;RESMED
1203;RACCORD D'ANGLE POUR MASQUE ADAM;S-616369-00;386;COVIDIEN MEDTRONIC
1204;RACCORD DE SORTIE AMOVIBLE MSERIES;1024615;387;RESPIRONICS
1205;RACCORD DE SORTIE POUR SOMNOBALANCE E;WM24452;388;LOWENSTEIN MEDICAL
1206;RACCORD DOUBLE ORIENTABLE -   104 - 13;104-13;1305;TELEFLEX
1207;RACCORD DROIT  22 F/22  F - EM 5101;EM5101;389;TELEFLEX
1208;RACCORD DROIT 15 CM 15F/15M - 332/5115;332/5115;390;COVIDIEN MEDTRONIC
1209;RACCORD DROIT 15 M / TUB. OXYGENE - AC70;AC70;614;TELEFLEX
1210;RACCORD DROIT 15F 22F;1979000;2306;INTERSURGICAL
1211;RACCORD DROIT 15M-22M;1943000;2346;INTERSURGICAL
1212;RACCORD DROIT 22 M / 22 F  -  AC 22;AC22;391;TELEFLEX
1213;RACCORD DROIT 22F - 15F INTERSURGICAL - 3511;3511;392;INTERSURGICAL
1214;RACCORD DROIT HUDSON 22 M/22 F - 41640;41640;1181;TELEFLEX
1215;RACCORD DROIT ID15 / OD 22 - 41422;41422;393;TELEFLEX
1216;RACCORD DROIT PRISE DE PRESSION - 41642;41642;615;TELEFLEX
